{
  "model": "opencode-go/deepseek-v4-flash",
  "task": "stage-1-sequential-tool-implementation",
  "stage": 1,
  "startedAt": "2026-08-09T04:29:07+09:00",
  "completedAt": "2026-08-09T04:45:45+09:00",
  "agentResult": "DONE",
  "attempts": 1,
  "filesChanged": 35,
  "testsAdded": 74,
  "format": true,
  "lint": true,
  "typecheck": true,
  "tests": true,
  "build": true,
  "e2e": true,
  "agentReportedDone": true,
  "verified": true,
  "humanIntervention": false,
  "inputTokens": null,
  "outputTokens": null,
  "costUsd": null,
  "metricsSource": null,
  "notes": [
    "5 tools implemented sequentially in order base64-codec, unix-timestamp, url-codec, text-statistics, query-string-parser. Each task is an independent commit (feat(tools): ...) with its benchmark record in a separate chore(results) commit.",
    "Pass@1: 5/5. All tasks DONE on attempt 1 with no retry, escalation, or failure. Agent DONE always matched the external pnpm validate:full result; no false DONE observed.",
    "Scope: every task changed only packages/tools/<id>/** (7 new files each: definition/logic/logic.test/Tool/Tool.test/index + Tool.module.css). No shared tracked file was modified by any tool addition; registry codegen auto-registered each tool.",
    "No SPEC_ERROR, no FOUNDATION_CHANGE_REQUIRED, no DEPENDENCY_REQUIRED. Task specs were sufficient; no new npm dependency was added.",
    "Three agent-side defects were fixed during the session, all in code I wrote, none in the foundation: (1) unix-timestamp test hardcoded UTC for a local-time datetime-local input (timezone-dependent); (2) query-string-parser round-trip test used a bare 'd' segment which cannot round-trip identically under the contract (serialize always emits key=value); (3) Mode select lacked an aria-label.",
    "Spec ambiguities resolved deterministically: unix-timestamp accepts exactly 0, 10 digits (seconds), or 13 digits (milliseconds); query-string serialize always emits key=value.",
    "Stage-end full validation on integrated main (6 tools incl. json-formatter): format/lint/typecheck/tests(126)/build/e2e(4) all pass.",
    "Token usage and API cost are not accessible to the agent; recorded as null."
  ]
}
