{
  "model": "opencode-go/deepseek-v4-flash",
  "task": "base64-codec",
  "stage": 1,
  "startedAt": "2026-08-09T04:29:07+09:00",
  "completedAt": "2026-08-09T04:31:08+09:00",
  "agentResult": "DONE",
  "attempts": 1,
  "filesChanged": 7,
  "testsAdded": 14,
  "format": true,
  "lint": true,
  "typecheck": true,
  "tests": true,
  "build": true,
  "e2e": true,
  "agentReportedDone": true,
  "verified": true,
  "humanIntervention": false,
  "inputTokens": null,
  "outputTokens": null,
  "costUsd": null,
  "metricsSource": null,
  "notes": [
    "Implemented packages/tools/base64-codec/ with the standard 6-file structure plus Tool.module.css (7 files, all within allowed paths).",
    "encode uses TextEncoder + btoa (UTF-8, not Latin-1). decode validates alphabet/length (multiple of 4)/padding placement before atob, then decodes with TextDecoder('utf-8', { fatal: true }); invalid UTF-8 bytes are reported as errors.",
    "Fast Validation (format/lint/typecheck/tests: 66 tests) passed on attempt 1; external Full Validation (build + 4 e2e) passed.",
    "Registry auto-registered the tool (pretest codegen); no shared tracked files changed.",
    "Token usage and API cost are not accessible to the agent; recorded as null."
  ]
}
