{
  "model": "opencode-go/deepseek-v4-flash",
  "task": "unix-timestamp",
  "stage": 1,
  "startedAt": "2026-08-09T04:32:22+09:00",
  "completedAt": "2026-08-09T04:34:50+09:00",
  "agentResult": "DONE",
  "attempts": 1,
  "filesChanged": 7,
  "testsAdded": 18,
  "format": true,
  "lint": true,
  "typecheck": true,
  "tests": true,
  "build": true,
  "e2e": true,
  "agentReportedDone": true,
  "verified": true,
  "humanIntervention": false,
  "inputTokens": null,
  "outputTokens": null,
  "costUsd": null,
  "metricsSource": null,
  "notes": [
    "Implemented packages/tools/unix-timestamp/ with the standard 6-file structure plus Tool.module.css (7 files, all within allowed paths).",
    "Timestamp validation accepts exactly 0, 10 digits (seconds), or 13 digits (milliseconds); anything else (non-numeric, negative, other lengths) is a visible error. 0 is a spec boundary value and must not error.",
    "datetime-local input is interpreted as local time (runtime timezone); output shows seconds, milliseconds, local time, and UTC time, each with its own CopyButton.",
    "One test expectation was fixed during the session: my first version hardcoded UTC for '1970-01-01T00:00' local input, which is timezone-dependent; changed to compute expected UTC from the Date object. Implementation logic was unchanged.",
    "Fast Validation passed (84 tests); external Full Validation (build + 4 e2e) passed.",
    "Token usage and API cost are not accessible to the agent; recorded as null."
  ]
}
