{
  "model": "opencode-go/deepseek-v4-flash",
  "task": "text-statistics",
  "stage": 1,
  "startedAt": "2026-08-09T04:37:53+09:00",
  "completedAt": "2026-08-09T04:39:08+09:00",
  "agentResult": "DONE",
  "attempts": 1,
  "filesChanged": 7,
  "testsAdded": 11,
  "format": true,
  "lint": true,
  "typecheck": true,
  "tests": true,
  "build": true,
  "e2e": true,
  "agentReportedDone": true,
  "verified": true,
  "humanIntervention": false,
  "inputTokens": null,
  "outputTokens": null,
  "costUsd": null,
  "metricsSource": null,
  "notes": [
    "Implemented packages/tools/text-statistics/ with the standard 6-file structure plus Tool.module.css (7 files, all within allowed paths).",
    "characters = Array.from().length (code points, not UTF-16 units); words = count of \\S+ fragments (ignores leading/trailing/consecutive whitespace, tabs, full-width spaces); lines = split('\\n').length with empty input special-cased to 0 lines.",
    "Statistics update in real time on every input change; empty input shows 0/0/0.",
    "Fast Validation passed on attempt 1 (108 tests); external Full Validation (build + 4 e2e) passed.",
    "Token usage and API cost are not accessible to the agent; recorded as null."
  ]
}
