{
  "model": "opencode-go/deepseek-v4-flash",
  "task": "url-codec",
  "stage": 1,
  "startedAt": "2026-08-09T04:35:39+09:00",
  "completedAt": "2026-08-09T04:37:03+09:00",
  "agentResult": "DONE",
  "attempts": 1,
  "filesChanged": 7,
  "testsAdded": 13,
  "format": true,
  "lint": true,
  "typecheck": true,
  "tests": true,
  "build": true,
  "e2e": true,
  "agentReportedDone": true,
  "verified": true,
  "humanIntervention": false,
  "inputTokens": null,
  "outputTokens": null,
  "costUsd": null,
  "metricsSource": null,
  "notes": [
    "Implemented packages/tools/url-codec/ with the standard 6-file structure plus Tool.module.css (7 files, all within allowed paths).",
    "encode uses encodeURIComponent (unreserved chars - _ . ! ~ * ' ( ) pass through). decode validates every % is followed by two hex digits before calling decodeURIComponent; malformed sequences and invalid UTF-8 (%C3%28) are visible errors, never passed through literally.",
    "Fast Validation passed on attempt 1 (97 tests); external Full Validation (build + 4 e2e) passed.",
    "Token usage and API cost are not accessible to the agent; recorded as null."
  ]
}
